{
  "id": "nucleus.launcher",
  "name": "Nucleus",
  "version": "0.1.0",
  "coreApiVersion": "1",
  "description": "One window for every app in the nucleus: install, open and update them.",
  "author": "Nucleus",
  "category": "system",
  "status": "alpha",
  "icon": "icon.svg",
  "launch": {
    "kind": "server",
    "args": ["dist/server.js"],
    "port": 4300,
    "window": true,
    "readyPath": "/api/health"
  },
  "permissions": [],
  "capabilities": ["app.launch", "app.discover"],
  "minShell": "0.1.0",
  "updateChannel": "stable"
}
